[
  {
    "句": "E01-S001",
    "说话人": "C001",
    "形态": "画内",
    "依据": "测试夹具",
    "确定度": "确认"
  },
  {
    "句": "E01-S002",
    "说话人": "C001",
    "形态": "画外",
    "依据": "测试夹具",
    "确定度": "确认"
  },
  {
    "句": "E01-S003",
    "说话人": "C002",
    "形态": "画内",
    "依据": "测试夹具",
    "确定度": "确认"
  }
]
