[
  {
    "句": "E01-S001",
    "说话人": "C001",
    "形态": "画内",
    "依据": "人工测试素材",
    "确定度": "确认"
  },
  {
    "句": "E01-S002",
    "说话人": "C002",
    "形态": "画内",
    "依据": "人工测试素材",
    "确定度": "确认"
  },
  {
    "句": "E01-S003",
    "说话人": "C001",
    "形态": "画内",
    "依据": "人工测试素材",
    "确定度": "确认"
  },
  {
    "句": "E01-S004",
    "说话人": "C002",
    "形态": "画内",
    "依据": "人工测试素材",
    "确定度": "确认"
  },
  {
    "句": "E01-S005",
    "说话人": "C001",
    "形态": "画内",
    "依据": "人工测试素材",
    "确定度": "确认"
  },
  {
    "句": "E01-S006",
    "说话人": "C002",
    "形态": "画内",
    "依据": "人工测试素材",
    "确定度": "确认"
  }
]
